Protein identifier	Contig id	Start	Stop	Strand	Gene symbol	Sequence name	Scope	Element type	Element subtype	Class	Subclass	Method	Target length	Reference sequence length	% Coverage of reference sequence	% Identity to reference sequence	Alignment length	Accession of closest sequence	Name of closest sequence	HMM id	HMM description
NA	contig_1	195162	195911	-	sel26	staphylococcal enterotoxin type 26	plus	VIRULENCE	VIRULENCE	NA	NA	BLASTX	250	250	100.00	96.00	250	KAG18833.1	staphylococcal enterotoxin type 26	NA	NA
NA	contig_1	432670	433485	-	sen	staphylococcal enterotoxin type N	plus	VIRULENCE	VIRULENCE	NA	NA	INTERNAL_STOP	272	272	100.00	99.63	272	SAO78304.1	staphylococcal enterotoxin type N	NA	NA
NA	contig_1	433527	434039	-	seu	staphylococcal enterotoxin type U	plus	VIRULENCE	VIRULENCE	NA	NA	PARTIALX	171	261	65.52	94.15	171	SGR88168.1	staphylococcal enterotoxin type U	NA	NA
NA	contig_1	435474	436253	-	seo	staphylococcal enterotoxin type O	plus	VIRULENCE	VIRULENCE	NA	NA	EXACTX	260	260	100.00	100.00	260	BAB42916.1	staphylococcal enterotoxin type O	NA	NA
NA	contig_1	561893	562240	-	scn	complement inhibitor SCIN-A	plus	VIRULENCE	VIRULENCE	NA	NA	EXACTX	116	116	100.00	100.00	116	ADL23798.1	complement inhibitor SCIN-A	NA	NA
NA	contig_1	564457	564945	-	sak	staphylokinase	plus	VIRULENCE	VIRULENCE	NA	NA	BLASTX	163	163	100.00	98.77	163	CAA24957.1	staphylokinase	NA	NA
NA	contig_1	633045	633122	-	hld	delta-hemolysin	plus	VIRULENCE	VIRULENCE	NA	NA	EXACTX	26	26	100.00	100.00	26	AGU62139.1	delta-hemolysin	NA	NA
NA	contig_1	705768	707030	-	murA_E291D	Staphylococcus aureus fosfomycin resistant MurA	core	AMR	POINT	FOSFOMYCIN	FOSFOMYCIN	POINTX	421	421	100.00	99.52	421	WP_000358006.1	UDP-N-acetylglucosamine 1-carboxyvinyltransferase MurA	NA	NA
NA	contig_1	705768	707030	-	murA_T396N	Staphylococcus aureus fosfomycin resistant MurA	core	AMR	POINT	FOSFOMYCIN	FOSFOMYCIN	POINTX	421	421	100.00	99.52	421	WP_000358006.1	UDP-N-acetylglucosamine 1-carboxyvinyltransferase MurA	NA	NA
NA	contig_1	783738	785177	-	lmrS	multidrug efflux MFS transporter LmrS	plus	STRESS	BIOCIDE	MACROLIDE/PHENICOL	CHLORAMPHENICOL/ERYTHROMYCIN	BLASTX	480	480	100.00	96.46	480	AAW38464.1	multidrug efflux MFS transporter LmrS	NA	NA
NA	contig_1	1045762	1046688	+	hlgA	bi-component gamma-hemolysin HlgAB subunit A	plus	VIRULENCE	VIRULENCE	NA	NA	BLASTX	309	309	100.00	99.35	309	AUU54669.1	bi-component gamma-hemolysin HlgAB subunit A	NA	NA
NA	contig_1	1047259	1048203	+	hlgC	bi-component gamma-hemolysin HlgCB subunit C	plus	VIRULENCE	VIRULENCE	NA	NA	BLASTX	315	315	100.00	97.46	315	CAA57277.1	bi-component gamma-hemolysin HlgCB subunit C	NA	NA
NA	contig_1	1048208	1049182	+	hlgB	bi-component gamma-hemolysin HlgAB/HlgCB subunit B	plus	VIRULENCE	VIRULENCE	NA	NA	BLASTX	325	325	100.00	99.38	325	CAA57278.1	bi-component gamma-hemolysin HlgAB/HlgCB subunit B	NA	NA
NA	contig_1	1085516	1086130	+	cadD	cadmium resistance transporter CadD	plus	STRESS	METAL	CADMIUM	CADMIUM	BLASTX	205	205	100.00	97.07	205	BAB43874.1	cadmium resistance transporter CadD	NA	NA
NA	contig_1	1105118	1105495	-	blaI	penicillinase repressor BlaI	core	AMR	AMR	BETA-LACTAM	BETA-LACTAM	BLASTX	126	126	100.00	99.21	126	WP_001284656.1	penicillinase repressor BlaI	NA	NA
NA	contig_1	1105488	1107242	-	blaR1	beta-lactam sensor/signal transducer BlaR1	core	AMR	AMR	BETA-LACTAM	BETA-LACTAM	BLASTX	585	585	100.00	99.83	585	WP_001096376.1	beta-lactam sensor/signal transducer BlaR1	NA	NA
NA	contig_1	1107349	1108191	+	blaPC1	BlaZ family penicillin-hydrolyzing class A beta-lactamase PC1	core	AMR	AMR	BETA-LACTAM	BETA-LACTAM	ALLELEX	281	281	100.00	100.00	281	WP_000733283.1	BlaZ family penicillin-hydrolyzing class A beta-lactamase PC1	NA	NA
NA	contig_1	1110544	1111980	-	aac(6')-Ie/aph(2'')-Ia	bifunctional aminoglycoside N-acetyltransferase AAC(6')-Ie/aminoglycoside O-phosphotransferase APH(2'')-Ia	core	AMR	AMR	AMINOGLYCOSIDE	AMIKACIN/GENTAMICIN/KANAMYCIN/TOBRAMYCIN	EXACTX	479	479	100.00	100.00	479	WP_001028144.1	bifunctional aminoglycoside N-acetyltransferase AAC(6')-Ie/aminoglycoside O-phosphotransferase APH(2'')-Ia	NA	NA
NA	contig_1	1113786	1115285	-	qacA	quaternary ammonium compound efflux MFS transporter QacA	core	STRESS	BIOCIDE	QUATERNARY AMMONIUM	QUATERNARY AMMONIUM	BLASTX	500	514	97.28	99.80	500	WP_000622776.1	quaternary ammonium compound efflux MFS transporter QacA	NA	NA
NA	contig_1	1115504	1116067	+	qacR	multidrug-binding transcriptional regulator QacR	plus	STRESS	BIOCIDE	QUATERNARY AMMONIUM	QUATERNARY AMMONIUM	BLASTX	188	188	100.00	99.47	188	ADK23698.1	multidrug-binding transcriptional regulator QacR	NA	NA
NA	contig_1	1118359	1119135	+	ser	staphylococcal enterotoxin type R	plus	VIRULENCE	VIRULENCE	NA	NA	EXACTX	259	259	100.00	100.00	259	EVY93839.1	staphylococcal enterotoxin type R	NA	NA
NA	contig_1	1119222	1120025	-	sej	staphylococcal enterotoxin type J	plus	VIRULENCE	VIRULENCE	NA	NA	BLASTX	268	268	100.00	99.25	268	AAC78590.1	staphylococcal enterotoxin type J	NA	NA
NA	contig_1	1120354	1121001	-	set	staphylococcal enterotoxin type T	plus	VIRULENCE	VIRULENCE	NA	NA	EXACTX	216	216	100.00	100.00	216	BAG06666.1	staphylococcal enterotoxin type T	NA	NA
NA	contig_1	1121443	1122183	-	ses	staphylococcal enterotoxin type S	plus	VIRULENCE	VIRULENCE	NA	NA	BLASTX	247	257	96.11	99.60	247	BAG06667.1	staphylococcal enterotoxin type S	NA	NA
NA	contig_1	1326645	1328171	-	aur	zinc metalloproteinase aureolysin	plus	VIRULENCE	VIRULENCE	NA	NA	BLASTX	509	509	100.00	93.71	509	EHO93748.1	zinc metalloproteinase aureolysin	NA	NA
NA	contig_1	1372537	1373586	+	icaC	polysaccharide intercellular adhesin biosynthesis/export protein IcaC	plus	VIRULENCE	VIRULENCE	NA	NA	BLASTX	350	350	100.00	99.43	350	AUU58561.1	polysaccharide intercellular adhesin biosynthesis/export protein IcaC	NA	NA
NA	contig_1	1420046	1422700	+	gyrA_S84L	Staphylococcus aureus quinolone resistant GyrA	core	AMR	POINT	QUINOLONE	QUINOLONE	POINTX	885	887	100.00	98.76	887	WP_000819084.1	DNA gyrase subunit A GyrA	NA	NA
NA	contig_1	1454654	1455289	+	fusC	fusidic acid resistance EF-G-binding protein FusC	core	AMR	AMR	FUSIDIC ACID	FUSIDIC ACID	ALLELEX	212	212	100.00	100.00	212	WP_001033157.1	fusidic acid resistance EF-G-binding protein FusC	NA	NA
NA	contig_1	1468667	1470670	-	mecA	PBP2a family beta-lactam-resistant peptidoglycan transpeptidase MecA	core	AMR	AMR	BETA-LACTAM	METHICILLIN	EXACTX	668	668	100.00	100.00	668	WP_000721306.1	PBP2a family beta-lactam-resistant peptidoglycan transpeptidase MecA	NA	NA
NA	contig_1	1482651	1484027	+	tet(K)	tetracycline efflux MFS transporter Tet(K)	core	AMR	AMR	TETRACYCLINE	TETRACYCLINE	EXACTX	459	459	100.00	100.00	459	WP_000492283.1	tetracycline efflux MFS transporter Tet(K)	NA	NA
NA	contig_1	1552241	1553590	+	tet(38)	tetracycline efflux MFS transporter Tet(38)	core	AMR	AMR	TETRACYCLINE	TETRACYCLINE	BLASTX	450	450	100.00	99.78	450	WP_001100293.1	tetracycline efflux MFS transporter Tet(38)	NA	NA
NA	contig_1	1775169	1776521	+	mepA	multidrug efflux MATE transporter MepA	plus	AMR	AMR	TETRACYCLINE	TIGECYCLINE	BLASTX	451	451	100.00	98.23	451	BAB41547.1	multidrug efflux MATE transporter MepA	NA	NA
NA	contig_1	1777153	1778508	-	glpT_A100V	Staphylococcus aureus fosfomycin resistant GlpT	core	AMR	POINT	FOSFOMYCIN	FOSFOMYCIN	POINTX	452	452	100.00	99.78	452	WP_001010111.1	glycerol-3-phosphate transporter GlpT	NA	NA
NA	contig_1	2810115	2812514	+	parC_S80F	Staphylococcus aureus quinolone resistant ParC	core	AMR	POINT	QUINOLONE	QUINOLONE	POINTX	800	800	100.00	98.88	800	WP_001289586.1	DNA topoisomerase IV subunit A ParC	NA	NA
