Protein identifier	Contig id	Start	Stop	Strand	Gene symbol	Sequence name	Scope	Element type	Element subtype	Class	Subclass	Method	Target length	Reference sequence length	% Coverage of reference sequence	% Identity to reference sequence	Alignment length	Accession of closest sequence	Name of closest sequence	HMM id	HMM description
NA	contig_1	2264	3106	-	blaPC1	BlaZ family penicillin-hydrolyzing class A beta-lactamase PC1	core	AMR	AMR	BETA-LACTAM	BETA-LACTAM	ALLELEX	281	281	100.00	100.00	281	WP_000733283.1	BlaZ family penicillin-hydrolyzing class A beta-lactamase PC1	NA	NA
NA	contig_1	3647	4966	+	blaR1	beta-lactam sensor/signal transducer BlaR1	core	AMR	AMR	BETA-LACTAM	BETA-LACTAM	INTERNAL_STOP	440	585	75.56	97.96	442	WP_001096376.1	beta-lactam sensor/signal transducer BlaR1	NA	NA
NA	contig_1	4959	5336	+	blaI	penicillinase repressor BlaI	core	AMR	AMR	BETA-LACTAM	BETA-LACTAM	BLASTX	126	126	100.00	99.21	126	WP_001284656.1	penicillinase repressor BlaI	NA	NA
NA	contig_1	27671	28285	-	cadD	cadmium resistance transporter CadD	plus	STRESS	METAL	CADMIUM	CADMIUM	BLASTX	205	205	100.00	97.07	205	BAB43874.1	cadmium resistance transporter CadD	NA	NA
NA	contig_1	64620	65594	-	hlgB	bi-component gamma-hemolysin HlgAB/HlgCB subunit B	plus	VIRULENCE	VIRULENCE	NA	NA	BLASTX	325	325	100.00	99.38	325	CAA57278.1	bi-component gamma-hemolysin HlgAB/HlgCB subunit B	NA	NA
NA	contig_1	65599	66543	-	hlgC	bi-component gamma-hemolysin HlgCB subunit C	plus	VIRULENCE	VIRULENCE	NA	NA	BLASTX	315	315	100.00	97.46	315	CAA57277.1	bi-component gamma-hemolysin HlgCB subunit C	NA	NA
NA	contig_1	67114	68040	-	hlgA	bi-component gamma-hemolysin HlgAB subunit A	plus	VIRULENCE	VIRULENCE	NA	NA	BLASTX	309	309	100.00	99.35	309	AUU54669.1	bi-component gamma-hemolysin HlgAB subunit A	NA	NA
NA	contig_1	327189	328628	+	lmrS	multidrug efflux MFS transporter LmrS	plus	STRESS	BIOCIDE	MACROLIDE/PHENICOL	CHLORAMPHENICOL/ERYTHROMYCIN	BLASTX	480	480	100.00	96.46	480	AAW38464.1	multidrug efflux MFS transporter LmrS	NA	NA
NA	contig_1	404743	406005	+	murA_E291D	Staphylococcus aureus fosfomycin resistant MurA	core	AMR	POINT	FOSFOMYCIN	FOSFOMYCIN	POINTX	421	421	100.00	99.52	421	WP_000358006.1	UDP-N-acetylglucosamine 1-carboxyvinyltransferase MurA	NA	NA
NA	contig_1	404743	406005	+	murA_T396N	Staphylococcus aureus fosfomycin resistant MurA	core	AMR	POINT	FOSFOMYCIN	FOSFOMYCIN	POINTX	421	421	100.00	99.52	421	WP_000358006.1	UDP-N-acetylglucosamine 1-carboxyvinyltransferase MurA	NA	NA
NA	contig_1	478654	478731	+	hld	delta-hemolysin	plus	VIRULENCE	VIRULENCE	NA	NA	EXACTX	26	26	100.00	100.00	26	AGU62139.1	delta-hemolysin	NA	NA
NA	contig_1	1032057	1034456	+	parC_S80F	Staphylococcus aureus quinolone resistant ParC	core	AMR	POINT	QUINOLONE	QUINOLONE	POINTX	800	800	100.00	98.88	800	WP_001289586.1	DNA topoisomerase IV subunit A ParC	NA	NA
NA	contig_1	1303957	1304706	-	sel26	staphylococcal enterotoxin type 26	plus	VIRULENCE	VIRULENCE	NA	NA	BLASTX	250	250	100.00	96.00	250	KAG18833.1	staphylococcal enterotoxin type 26	NA	NA
NA	contig_1	1541335	1542150	-	sen	staphylococcal enterotoxin type N	plus	VIRULENCE	VIRULENCE	NA	NA	INTERNAL_STOP	272	272	100.00	99.63	272	SAO78304.1	staphylococcal enterotoxin type N	NA	NA
NA	contig_1	1542192	1542704	-	seu	staphylococcal enterotoxin type U	plus	VIRULENCE	VIRULENCE	NA	NA	PARTIALX	171	261	65.52	94.15	171	SGR88168.1	staphylococcal enterotoxin type U	NA	NA
NA	contig_1	1544139	1544918	-	seo	staphylococcal enterotoxin type O	plus	VIRULENCE	VIRULENCE	NA	NA	EXACTX	260	260	100.00	100.00	260	BAB42916.1	staphylococcal enterotoxin type O	NA	NA
NA	contig_1	1671891	1672238	-	scn	complement inhibitor SCIN-A	plus	VIRULENCE	VIRULENCE	NA	NA	EXACTX	116	116	100.00	100.00	116	ADL23798.1	complement inhibitor SCIN-A	NA	NA
NA	contig_1	1674454	1674942	-	sak	staphylokinase	plus	VIRULENCE	VIRULENCE	NA	NA	BLASTX	163	163	100.00	98.77	163	CAA24957.1	staphylokinase	NA	NA
NA	contig_1	2234856	2236211	+	glpT_A100V	Staphylococcus aureus fosfomycin resistant GlpT	core	AMR	POINT	FOSFOMYCIN	FOSFOMYCIN	POINTX	452	452	100.00	99.78	452	WP_001010111.1	glycerol-3-phosphate transporter GlpT	NA	NA
NA	contig_1	2236844	2238196	-	mepA	multidrug efflux MATE transporter MepA	plus	AMR	AMR	TETRACYCLINE	TIGECYCLINE	BLASTX	451	451	100.00	98.23	451	BAB41547.1	multidrug efflux MATE transporter MepA	NA	NA
NA	contig_1	2460345	2461124	-	tet(38)	tetracycline efflux MFS transporter Tet(38)	core	AMR	AMR	TETRACYCLINE	TETRACYCLINE	INTERNAL_STOP	260	450	58.00	97.32	261	WP_001100293.1	tetracycline efflux MFS transporter Tet(38)	NA	NA
NA	contig_1	2529483	2530859	-	tet(K)	tetracycline efflux MFS transporter Tet(K)	core	AMR	AMR	TETRACYCLINE	TETRACYCLINE	EXACTX	459	459	100.00	100.00	459	WP_000492283.1	tetracycline efflux MFS transporter Tet(K)	NA	NA
NA	contig_1	2542841	2544844	+	mecA	PBP2a family beta-lactam-resistant peptidoglycan transpeptidase MecA	core	AMR	AMR	BETA-LACTAM	METHICILLIN	EXACTX	668	668	100.00	100.00	668	WP_000721306.1	PBP2a family beta-lactam-resistant peptidoglycan transpeptidase MecA	NA	NA
NA	contig_1	2558223	2558858	-	fusC	FusC family fusidic acid resistance EF-G-binding protein	core	AMR	AMR	FUSIDIC ACID	FUSIDIC ACID	BLASTX	212	212	100.00	96.23	212	WP_001033157.1	fusidic acid resistance EF-G-binding protein FusC	NA	NA
NA	contig_1	2597667	2600321	-	gyrA_S84L	Staphylococcus aureus quinolone resistant GyrA	core	AMR	POINT	QUINOLONE	QUINOLONE	POINTX	885	887	100.00	98.76	887	WP_000819084.1	DNA gyrase subunit A GyrA	NA	NA
NA	contig_1	2625869	2629417	+	cna	collagen adhesin Cna	plus	VIRULENCE	VIRULENCE	NA	NA	BLASTX	1183	1183	100.00	97.80	1183	BAB96477.1	collagen adhesin Cna	NA	NA
NA	contig_1	2647343	2648392	-	icaC	polysaccharide intercellular adhesin biosynthesis/export protein IcaC	plus	VIRULENCE	VIRULENCE	NA	NA	BLASTX	350	350	100.00	99.43	350	AUU58561.1	polysaccharide intercellular adhesin biosynthesis/export protein IcaC	NA	NA
NA	contig_1	2692758	2694284	+	aur	zinc metalloproteinase aureolysin	plus	VIRULENCE	VIRULENCE	NA	NA	BLASTX	509	509	100.00	93.71	509	EHO93748.1	zinc metalloproteinase aureolysin	NA	NA
NA	contig_1	2898768	2899508	+	ses	staphylococcal enterotoxin type S	plus	VIRULENCE	VIRULENCE	NA	NA	BLASTX	247	257	96.11	99.60	247	BAG06667.1	staphylococcal enterotoxin type S	NA	NA
NA	contig_1	2899950	2900597	+	set	staphylococcal enterotoxin type T	plus	VIRULENCE	VIRULENCE	NA	NA	EXACTX	216	216	100.00	100.00	216	BAG06666.1	staphylococcal enterotoxin type T	NA	NA
NA	contig_1	2900926	2901729	+	sej	staphylococcal enterotoxin type J	plus	VIRULENCE	VIRULENCE	NA	NA	BLASTX	268	268	100.00	99.25	268	AAC78590.1	staphylococcal enterotoxin type J	NA	NA
NA	contig_1	2901816	2902592	-	ser	staphylococcal enterotoxin type R	plus	VIRULENCE	VIRULENCE	NA	NA	EXACTX	259	259	100.00	100.00	259	EVY93839.1	staphylococcal enterotoxin type R	NA	NA
NA	contig_1	2904884	2905447	-	qacR	multidrug-binding transcriptional regulator QacR	plus	STRESS	BIOCIDE	QUATERNARY AMMONIUM	QUATERNARY AMMONIUM	BLASTX	188	188	100.00	99.47	188	ADK23698.1	multidrug-binding transcriptional regulator QacR	NA	NA
NA	contig_1	2905666	2906451	+	qacA	quaternary ammonium compound efflux MFS transporter QacA	core	STRESS	BIOCIDE	QUATERNARY AMMONIUM	QUATERNARY AMMONIUM	PARTIALX	262	514	50.97	98.47	262	WP_000622776.1	quaternary ammonium compound efflux MFS transporter QacA	NA	NA
NA	contig_1	2909003	2910439	+	aac(6')-Ie/aph(2'')-Ia	bifunctional aminoglycoside N-acetyltransferase AAC(6')-Ie/aminoglycoside O-phosphotransferase APH(2'')-Ia	core	AMR	AMR	AMINOGLYCOSIDE	AMIKACIN/GENTAMICIN/KANAMYCIN/TOBRAMYCIN	EXACTX	479	479	100.00	100.00	479	WP_001028144.1	bifunctional aminoglycoside N-acetyltransferase AAC(6')-Ie/aminoglycoside O-phosphotransferase APH(2'')-Ia	NA	NA
NA	contig_3	1012	1743	-	erm(C)	23S rRNA (adenine(2058)-N(6))-methyltransferase Erm(C)	core	AMR	AMR	LINCOSAMIDE/MACROLIDE/STREPTOGRAMIN	CLINDAMYCIN/ERYTHROMYCIN/STREPTOGRAMIN B/TYLOSIN	EXACTX	244	244	100.00	100.00	244	WP_001003263.1	23S rRNA (adenine(2058)-N(6))-methyltransferase Erm(C)	NA	NA
